id,slug,title,synopsis,year,duration,rating,thumbnail,poster,trailerUrl,videoUrl,videoType,tags,moods,cast,director,__v,createdAt,updatedAt,videoHeaders
v-n-may,v-n-may,Vận May ,"Gabriel, một thiên thần thừa lòng tốt nhưng thiếu kỹ năng, tự dưng đi can thiệp vào cuộc sống của một anh nhân viên thời vụ lương ba cọc ba đồng và một đại gia chuyên đầu tư mạo hiểm, rồi làm rối tung rối mù hết cả lên.",2025,1h 38m,4.5,https://static.nutscdn.com/vimg/300-0/b4f0ad68a856b7f1e7e431d56cf9c910.webp,https://static.nutscdn.com/vimg/300-0/7bb9067254399813bbbf9a14567f23a3.jpg,,https://mistcloud50.pro/hls/4GlI04oK6NYYOA5hT0kgrnNefqJWX8DxAggLGBlTN4C71KwQHlLCLJPBrLfxHNjzJKW69Hj+q96yV4QFnZd4-g==/bWFzdGVyLm0zdTg=.m3u8,mp4,"['Hành động', 'Hài']","['Hành động', 'Khoa học viễn tưởng']","['Keanu Reeves', 'Aziz Ansari']",Aziz Ansari,0,2025-11-26 02:46:31.880,2025-11-26 02:46:31.880,
th-tr-n-baramulla,th-tr-n-baramulla,Thị Trấn Baramulla,"Điều tra về vụ bắt cóc trẻ em, viên cảnh sát nọ lật mở những bí mật rùng rợn khi hàng loạt sự kiện siêu nhiên đe dọa gia đình anh và thị trấn yên bình Baramulla.",2025,2h,4.5,https://static.nutscdn.com/vimg/300-0/70b005f1011f692f90ed0805900ccb0b.jpg,https://static.nutscdn.com/vimg/300-0/70b005f1011f692f90ed0805900ccb0b.jpg,,https://owakshina.store/hls/v3dZoW0M3NgIRk1qeowM5jIh-EXIAKjpuc3a305H1N6NJtqNqKfpRfBXZeUGqelztHM3G99lYCxWU3MvEZGmMg==/bWFzdGVyLm0zdTg=.m3u8,hls,"['Hành động', 'Sci-fi']","['Hành động', 'Khoa học viễn tưởng']","['Manav Kaul', 'Neelofar Hamid']",Aditya Suhas Jambhale,0,2025-11-26 02:46:31.881,2025-11-26 02:46:31.881,"{'accept': '*/*', 'accept-language': 'vi-VN,vi;q=0.9,zh-CN;q=0.8,zh;q=0.7,fr-FR;q=0.6,fr;q=0.5,en-US;q=0.4,en;q=0.3', 'cache-control': 'no-cache', 'pragma': 'no-cache', 'priority': 'u=1, i', 'sec-ch-ua': '""Chromium"";v=""142"", ""Google Chrome"";v=""142"", ""Not_A Brand"";v=""99""', 'sec-ch-ua-mobile': '?0', 'sec-ch-ua-platform': '""Windows""', 'sec-fetch-dest': 'empty', 'sec-fetch-mode': 'cors', 'sec-fetch-site': 'cross-site', 'Referer': 'https://goatembed.com/', 'User-Agent': 'Mozilla/5.0 (Windows NT 10.0; Win64; x64) AppleWebKit/537.36 (KHTML, like Gecko) Chrome/142.0.0.0 Safari/537.36'}"
r-c-r-i-s-m-panh,r-c-r-i-s-m-panh,Rắc Rối Sâm Panh,Một giám đốc điều hành người Mỹ đầy nhiệt huyết đến Paris với quyết tâm mua lại một thương hiệu sâm panh trước Giáng sinh – rồi vô tình phải lòng người thừa kế đế chế sâm panh đó.,2025,1h 20m,6.2,https://static.nutscdn.com/vimg/300-0/390535064ab9a37387948e796eb8482d.jpg,https://static.nutscdn.com/vimg/300-0/390535064ab9a37387948e796eb8482d.jpg,,https://snowbreeze49.live/hls/fFTZm24anhb36dUphRT4PSOBhoAhBvk2SJMjTa3eAmZqCpZRyvBsUCMVrEypQVUDn+I7MYd6OCjP7UqauhWxHQ==/bWFzdGVyLm0zdTg=.m3u8,hls,"['Tình cảm', 'hài']","['Hành động', 'Khoa học viễn tưởng']","['Otto Moller', 'Ryan Garner']",,0,2025-11-26 02:46:31.881,2025-11-26 02:46:31.881,"{'accept': '*/*', 'accept-language': 'vi-VN,vi;q=0.9,zh-CN;q=0.8,zh;q=0.7,fr-FR;q=0.6,fr;q=0.5,en-US;q=0.4,en;q=0.3', 'cache-control': 'no-cache', 'pragma': 'no-cache', 'priority': 'u=1, i', 'sec-ch-ua': '""Chromium"";v=""142"", ""Google Chrome"";v=""142"", ""Not_A Brand"";v=""99""', 'sec-ch-ua-mobile': '?0', 'sec-ch-ua-platform': '""Windows""', 'sec-fetch-dest': 'empty', 'sec-fetch-mode': 'cors', 'sec-fetch-site': 'cross-site', 'Referer': 'https://goatembed.com/', 'User-Agent': 'Mozilla/5.0 (Windows NT 10.0; Win64; x64) AppleWebKit/537.36 (KHTML, like Gecko) Chrome/142.0.0.0 Safari/537.36'}"
cu-c-phi-u-l-u-trong-gi-c-m-ng,cu-c-phi-u-l-u-trong-gi-c-m-ng,Cuộc Phiêu Lưu Trong Giấc Mộng,Bộ đôi chị gái và em trai nọ phiêu lưu khắp vùng đất siêu quái đản trong mơ để thỉnh cầu Người Cát ban cho họ một gia đình hoàn hảo.,2025,1h 31m,6.5,https://static.nutscdn.com/vimg/300-0/30c8efeb97b346cab8a8c230c8b94096.jpg,https://static.nutscdn.com/vimg/300-0/21ef81e8096918ce76d47f372d367172.jpg,,https://owakshina.store/hls/3OJcM31O2gJ-mKKjGz-wTGTbJzjuwr7VdS0mCbCuMtGRuqAntDmY5-U-JH8+R8JU3JikhC3wIKz6-izBjcnSKQ==/bWFzdGVyLm0zdTg=.m3u8,hls,"['Gia đình', 'hài', 'viễn tưởng']","['Hành động', 'Khoa học viễn tưởng']","['Elias Janssen', 'Jolie Hoang-Rappaport']","Erik Benson, Alex Woo",0,2025-11-26 02:46:31.881,2025-11-26 02:46:31.881,"{'accept': '*/*', 'accept-language': 'vi-VN,vi;q=0.9,zh-CN;q=0.8,zh;q=0.7,fr-FR;q=0.6,fr;q=0.5,en-US;q=0.4,en;q=0.3', 'cache-control': 'no-cache', 'pragma': 'no-cache', 'priority': 'u=1, i', 'sec-ch-ua': '""Chromium"";v=""142"", ""Google Chrome"";v=""142"", ""Not_A Brand"";v=""99""', 'sec-ch-ua-mobile': '?0', 'sec-ch-ua-platform': '""Windows""', 'sec-fetch-dest': 'empty', 'sec-fetch-mode': 'cors', 'sec-fetch-site': 'cross-site', 'Referer': 'https://goatembed.com/', 'User-Agent': 'Mozilla/5.0 (Windows NT 10.0; Win64; x64) AppleWebKit/537.36 (KHTML, like Gecko) Chrome/142.0.0.0 Safari/537.36'}"
k-x-u,k-x-u,Kẻ Xấu,"ại thị trấn Colt Lake, bang Tennessee, Sam Evans đang nỗ lực đối phó với nạn ma túy đá hoành hành. Tuy nhiên, khi điệp viên ngầm Bobby Gaines xuất hiện, Evans bị gạt sang một bên. Dù Evans có mối quan hệ sâu sắc với dân địa phương, Gaines lại được ca ngợi như một anh hùng. Nhưng rồi, những nghi ngờ quanh con người thật của Gaines bắt đầu xuất hiện, dần hé lộ một câu chuyện phức tạp và đầy uẩn khúc phía sau.",2025,1h 37m,4.8,https://static.nutscdn.com/vimg/300-0/e08064026262cfc3579f52dd5075d0ae.jpg,https://static.nutscdn.com/vimg/300-0/e08064026262cfc3579f52dd5075d0ae.jpg,,https://hitmefirstcdn.store/hls/z0VHjHwwxRz+APx8Vy+7gcZayOX4-CVDt84qDMQY0qhAkHg38eHhKpuBJmKSdoJfqo2h3CywAQww5XUmJZZOMg==/bWFzdGVyLm0zdTg=.m3u8,hls,"['Hành động', 'Hài']","['Hành động', 'Khoa học viễn tưởng']","['Seann William Scott', 'Johnny Simmons']",Michael Diliberti,0,2025-11-26 02:46:31.881,2025-11-26 02:46:31.881,"{'accept': '*/*', 'accept-language': 'vi-VN,vi;q=0.9,zh-CN;q=0.8,zh;q=0.7,fr-FR;q=0.6,fr;q=0.5,en-US;q=0.4,en;q=0.3', 'cache-control': 'no-cache', 'pragma': 'no-cache', 'priority': 'u=1, i', 'sec-ch-ua': '""Chromium"";v=""142"", ""Google Chrome"";v=""142"", ""Not_A Brand"";v=""99""', 'sec-ch-ua-mobile': '?0', 'sec-ch-ua-platform': '""Windows""', 'sec-fetch-dest': 'empty', 'sec-fetch-mode': 'cors', 'sec-fetch-site': 'cross-site', 'Referer': 'https://goatembed.com/', 'User-Agent': 'Mozilla/5.0 (Windows NT 10.0; Win64; x64) AppleWebKit/537.36 (KHTML, like Gecko) Chrome/142.0.0.0 Safari/537.36'}"
hoa-h-ng-c-gai,hoa-h-ng-c-gai,Hoa Hồng Có Gai,"Cuộc sống của Ivy và Theo tưởng chừng hoàn hảo: sự nghiệp thành công, hôn nhân hạnh phúc, con cái ngoan ngoãn. Nhưng đằng sau lớp vỏ của một gia đình lý tưởng ấy là cơn bão ngầm đang dần hình thành — khi sự nghiệp của Theo tuột dốc trong khi tham vọng của Ivy thăng hoa, thổi bùng lên ngọn lửa ganh đua và oán giận âm ỉ có thể thiêu rụi tất cả.",2025,1h 45m,6.7,https://static.nutscdn.com/vimg/300-0/37c692b0ec5829f74f87e4a0ba34e13f.jpg,https://static.nutscdn.com/vimg/300-0/37c692b0ec5829f74f87e4a0ba34e13f.jpg,,https://owakshina.store/hls/KFB6tRg8g4XFCwt2+6l76rXCpRf4YnQRzH3QNwFGe5npvxHlsYc63qxbJXoWM6+n5OW92OVPjrWfssec-ZC54w==/bWFzdGVyLm0zdTg=.m3u8,hls,"['Tình Cảm', 'Gia Đình', 'Hài', 'Lãng Mạn']","['Hành động', 'Khoa học viễn tưởng']","['Olivia Colman', 'Benedict Cumberbatch', 'Andy Samberg']","James Excell, Joe Payne, Sophie Graham, Sophy Taylor, Alana Marmion-Warr, Jay Roach, Jessica Laws",0,2025-11-26 02:46:31.881,2025-11-26 02:46:31.881,"{'accept': '*/*', 'accept-language': 'vi-VN,vi;q=0.9,zh-CN;q=0.8,zh;q=0.7,fr-FR;q=0.6,fr;q=0.5,en-US;q=0.4,en;q=0.3', 'cache-control': 'no-cache', 'pragma': 'no-cache', 'priority': 'u=1, i', 'sec-ch-ua': '""Chromium"";v=""142"", ""Google Chrome"";v=""142"", ""Not_A Brand"";v=""99""', 'sec-ch-ua-mobile': '?0', 'sec-ch-ua-platform': '""Windows""', 'sec-fetch-dest': 'empty', 'sec-fetch-mode': 'cors', 'sec-fetch-site': 'cross-site', 'Referer': 'https://goatembed.com/', 'User-Agent': 'Mozilla/5.0 (Windows NT 10.0; Win64; x64) AppleWebKit/537.36 (KHTML, like Gecko) Chrome/142.0.0.0 Safari/537.36'}"
frankenstein,frankenstein,Frankenstein,Đạo diễn đoạt giải Oscar Guillermo del Toro tái hiện câu chuyện kinh điển của Mary Shelley về một nhà khoa học lỗi lạc và tạo vật mà tham vọng quái dị của anh tạo ra.,2025,2h 30m,7.5,https://static.nutscdn.com/vimg/300-0/d28bfd4cc191a1d2de53f0fc87ee38da.webp,https://static.nutscdn.com/vimg/300-0/d28bfd4cc191a1d2de53f0fc87ee38da.webp,, https://hitmefirstcdn.store/hls/IeoCtJCpzwQGd-1PGW1rvW6iBAuPACPe6ACofCiN+f5-hlua037Ddv4oIDFdoaKiSnkDdRdXATCosOwhjCntvWRWDG0vTU2Z7qqskgXgVZg=/bWFzdGVyLm0zdTg=.m3u8,hls,"['Kinh Dị', 'Cổ Điển', 'Khoa Học', 'Viễn Tưởng']","['Hành động', 'Khoa học viễn tưởng']","['Oscar Isaac', 'Jacob Elordi', 'Mia Goth']","Guillermo del Toro, Dug Rotstein",0,2025-11-26 02:46:31.881,2025-11-26 02:46:31.881,"{'accept': '*/*', 'accept-language': 'vi-VN,vi;q=0.9,zh-CN;q=0.8,zh;q=0.7,fr-FR;q=0.6,fr;q=0.5,en-US;q=0.4,en;q=0.3', 'cache-control': 'no-cache', 'pragma': 'no-cache', 'priority': 'u=1, i', 'sec-ch-ua': '""Chromium"";v=""142"", ""Google Chrome"";v=""142"", ""Not_A Brand"";v=""99""', 'sec-ch-ua-mobile': '?0', 'sec-ch-ua-platform': '""Windows""', 'sec-fetch-dest': 'empty', 'sec-fetch-mode': 'cors', 'sec-fetch-site': 'cross-site', 'Referer': 'https://goatembed.com/', 'User-Agent': 'Mozilla/5.0 (Windows NT 10.0; Win64; x64) AppleWebKit/537.36 (KHTML, like Gecko) Chrome/142.0.0.0 Safari/537.36'}"
phi-v-b-n,phi-v-b-n,Phi Vụ Bẩn,"Một siêu trộm mang tên Parker bước vào phi vụ táo bạo nhất đời mình – một vụ cướp có thể thay đổi tất cả. Để thành công, anh phải vượt qua những kẻ thù nguy hiểm nhất: một nhà độc tài khét tiếng Nam Mỹ, băng mafia New York tàn nhẫn, và một tỷ phú quyền lực thao túng cả thế giới.Giữa mê cung của lừa lọc, phản bội và những màn đấu trí nghẹt",2025,2h 05m,5.9,https://static.nutscdn.com/vimg/300-0/891e5bab5fa7b54e207f9f7622a419ab.jpg,https://static.nutscdn.com/vimg/300-0/891e5bab5fa7b54e207f9f7622a419ab.jpg,,https://quetinuk271.site/hls/jxjPlXMnYEzzAPXR-DmaqcScDFc5mV5VNSGJsDPordFjUnIKfSilKLwjiBJWSpiqV0k5ZZA9rMMLWeL3BQ1VtexK5elreWU6663pT9Xot8I=/bWFzdGVyLm0zdTg=.m3u8,hls,"['Chính Kịch', 'Hành Động', 'Gay Cấn', 'Hình Sự']","['Hành động', 'Khoa học viễn tưởng']","['Mark Wahlberg', 'LaKeith Stanfield', 'Rosa Salazar']",Phi Vụ Bẩn,0,2025-11-26 02:46:31.882,2025-11-26 02:46:31.882,"{'accept': '*/*', 'accept-language': 'vi-VN,vi;q=0.9,zh-CN;q=0.8,zh;q=0.7,fr-FR;q=0.6,fr;q=0.5,en-US;q=0.4,en;q=0.3', 'cache-control': 'no-cache', 'pragma': 'no-cache', 'priority': 'u=1, i', 'sec-ch-ua': '""Chromium"";v=""142"", ""Google Chrome"";v=""142"", ""Not_A Brand"";v=""99""', 'sec-ch-ua-mobile': '?0', 'sec-ch-ua-platform': '""Windows""', 'sec-fetch-dest': 'empty', 'sec-fetch-mode': 'cors', 'sec-fetch-site': 'cross-site', 'Referer': 'https://goatembed.com/', 'User-Agent': 'Mozilla/5.0 (Windows NT 10.0; Win64; x64) AppleWebKit/537.36 (KHTML, like Gecko) Chrome/142.0.0.0 Safari/537.36'}"
c-m-y-nghi-n,c-m-y-nghi-n,Cỗ Máy Nghiền,"Vào cuối những năm 1990, võ sĩ MMA đầy triển vọng Mark Kerr khao khát trở thành tay đấm vĩ đại nhất thế giới. Tuy nhiên, anh cũng phải chiến đấu với cơn nghiện thuốc và mối quan hệ đầy biến động với bạn gái Dawn.",2025,2h 03m,6.5,https://static.nutscdn.com/vimg/300-0/b29e519c5480544c6b6f07cec11945ff.jpg,https://static.nutscdn.com/vimg/300-0/b29e519c5480544c6b6f07cec11945ff.jpg,, https://quetinuk271.site/hls/z59u0a9zXTXAkrR0vCmsCQOKIbYCEfQwxSERKZGZCl0jrYelDoRaZ5S-zCZAbajNIBwVAt+eyvoAb4tLwaRLfw==/bWFzdGVyLm0zdTg=.m3u8,hls,"['Chính Kịch', 'Hành Động', 'Chiếu Rạp', 'Gay Cấn', 'Cổ Điển', 'Tập Luyện', 'Thể Thao']","['Hành động', 'Khoa học viễn tưởng']","['Dwayne Johnson', 'Emily Blunt', 'Ryan Bader']","Hannah Christine Kess, Misha Bukowski, Benny Safdie, David Tierney Lerner, Joel Cyr, Peter McGrew, Silver Butler, Hannah Broad",0,2025-11-26 02:46:31.882,2025-11-26 02:46:31.882,"{'accept': '*/*', 'accept-language': 'vi-VN,vi;q=0.9,zh-CN;q=0.8,zh;q=0.7,fr-FR;q=0.6,fr;q=0.5,en-US;q=0.4,en;q=0.3', 'cache-control': 'no-cache', 'pragma': 'no-cache', 'priority': 'u=1, i', 'sec-ch-ua': '""Chromium"";v=""142"", ""Google Chrome"";v=""142"", ""Not_A Brand"";v=""99""', 'sec-ch-ua-mobile': '?0', 'sec-ch-ua-platform': '""Windows""', 'sec-fetch-dest': 'empty', 'sec-fetch-mode': 'cors', 'sec-fetch-site': 'cross-site', 'Referer': 'https://goatembed.com/', 'User-Agent': 'Mozilla/5.0 (Windows NT 10.0; Win64; x64) AppleWebKit/537.36 (KHTML, like Gecko) Chrome/142.0.0.0 Safari/537.36'}"
g-qu-n-tr,g-qu-n-tr,Gã Quản Trò,"Bốn người bị mắc kẹt trong một chương trình trò chơi tàn bạo, nơi họ buộc phải đấu trí với một tên sát nhân hàng loạt biến thái trong cuộc đua nghẹt thở với thời gian. Mỗi bước đi có thể đưa họ đến tự do — hoặc đến một cái kết kinh hoàng.",2025, 1h 29m,4.8,https://static.nutscdn.com/vimg/300-0/56db57e0cdf49d1a2c76a94207707b87.jpg,https://static.nutscdn.com/vimg/300-0/56db57e0cdf49d1a2c76a94207707b87.jpg,,https://sunfog88.live/hls/7GeDjhst35RY1SYsKtm4tiZL--MqCsggZDWMblfIqzrULPXdPn0+50wH8lcgkpH76jZPeltNzBNdP5QRw+CWXQ==/bWFzdGVyLm0zdTg=.m3u8,hls,"['Gay Cấn', 'Kinh Dị', 'Tâm Lý']","['Hành động', 'Khoa học viễn tưởng']","['Ella-Rae Smith', 'Jamie Flatters']",D.W. Medoff,0,2025-11-26 02:46:31.882,2025-11-26 02:46:31.882,"{'accept': '*/*', 'accept-language': 'vi-VN,vi;q=0.9,zh-CN;q=0.8,zh;q=0.7,fr-FR;q=0.6,fr;q=0.5,en-US;q=0.4,en;q=0.3', 'cache-control': 'no-cache', 'pragma': 'no-cache', 'priority': 'u=1, i', 'sec-ch-ua': '""Chromium"";v=""142"", ""Google Chrome"";v=""142"", ""Not_A Brand"";v=""99""', 'sec-ch-ua-mobile': '?0', 'sec-ch-ua-platform': '""Windows""', 'sec-fetch-dest': 'empty', 'sec-fetch-mode': 'cors', 'sec-fetch-site': 'cross-site', 'Referer': 'https://goatembed.com/', 'User-Agent': 'Mozilla/5.0 (Windows NT 10.0; Win64; x64) AppleWebKit/537.36 (KHTML, like Gecko) Chrome/142.0.0.0 Safari/537.36'}"
tay-m-th-p,tay-m-th-p,Tay Đấm Thép,"Phim đặt trong tương lai không xa, loài người tạo nên những robot siêu đẳng, khi mà quyền Anh robot trở thành môn thể thao phổ biến và có thể thay thế con người trổ tài trên sàn đấm bốc. Nhưng đó cũng là nơi Charlie - một võ sĩ quyền anh nổi tiếng với những cú đấm “thần sầu” - cảm thấy không thể hòa hợp. Đúng lúc ấy, anh tình cờ tìm được 1 chú robot ở bãi phế thải và tin rằng nó sẽ giúp anh vô địch. Trong khi Charlie theo đuổi hy vọng leo lên vị trí dẫn đầu thì một điều bất ngờ khác cũng đến với anh. Đứa con trai lưu lạc bấy lâu đột nhiên xuất hiện và muốn biết nhiều hơn về bố mình…",2025,1h 55m,7.1,https://images.unsplash.com/photo-1524985069026-dd778a71c7b4?auto=format&fit=crop&w=900&q=80,https://images.unsplash.com/photo-1524985069026-dd778a71c7b4?auto=format&fit=crop&w=900&q=80,,https://mistcloud50.pro/hls/1Me-V-FBJxt0BGJU8Q12KalFBk99K+iVZDr0KQ8E+epNfeopa8+2XkcaUnWEKCsD1Vk9hojPAKlWM8LMshUJFg==/bWFzdGVyLm0zdTg=.m3u8,hls,"['Chính Kịch', 'Hành Động', 'Khoa Học']","['Hành động', 'Khoa học viễn tưởng']",[],"Shawn Levy, Josh McLaglen, Diane Durant",0,2025-11-26 02:46:31.882,2025-11-26 02:46:31.882,"{'accept': '*/*', 'accept-language': 'vi-VN,vi;q=0.9,zh-CN;q=0.8,zh;q=0.7,fr-FR;q=0.6,fr;q=0.5,en-US;q=0.4,en;q=0.3', 'cache-control': 'no-cache', 'pragma': 'no-cache', 'priority': 'u=1, i', 'sec-ch-ua': '""Chromium"";v=""142"", ""Google Chrome"";v=""142"", ""Not_A Brand"";v=""99""', 'sec-ch-ua-mobile': '?0', 'sec-ch-ua-platform': '""Windows""', 'sec-fetch-dest': 'empty', 'sec-fetch-mode': 'cors', 'sec-fetch-site': 'cross-site', 'Referer': 'https://goatembed.com/', 'User-Agent': 'Mozilla/5.0 (Windows NT 10.0; Win64; x64) AppleWebKit/537.36 (KHTML, like Gecko) Chrome/142.0.0.0 Safari/537.36'}"
b-c-ng-c-ng,b-c-ng-c-ng,Bước Đường Cùng,"Man Soo (Lee Byung Hun), một nhân viên văn phòng bỗng chốc bị sa thải khỏi một công ty mà anh đã gắn bó 25 năm, cuộc sống êm ấm vừa mới có được lại bị đảo ngược. Để chu toàn cho gia đình là vợ Mi Ri (Son Ye Jin) và hai con, người đàn ông này nhất quyết phải sinh tồn đến cùng, bao gồm cả việc nhận những nghề cực đoan nhất.",2025,2h 19m,7.8,https://static.nutscdn.com/vimg/300-0/73c80fc59d2b6006ce877634032fe05a.jpg,https://static.nutscdn.com/vimg/300-0/73c80fc59d2b6006ce877634032fe05a.jpg,,https://snowbreeze49.live/hls/q9mtdkBXMVvhl-MyqBaLcv2ohqwsb9+tjop8eftoE9wTc3WanqV6N4aiOOiKLFuX-2+kawXQTmtQDtniDY1euA==/bWFzdGVyLm0zdTg=.m3u8,hls,"['Gay Cấn', 'Hình Sự', 'Hài Tâm Lý']","['Hành động', 'Khoa học viễn tưởng']","['Lee Byung-hun', 'Son Ye-jin']",Park Chan-wook,0,2025-11-26 02:46:31.882,2025-11-26 02:46:31.882,"{'accept': '*/*', 'accept-language': 'vi-VN,vi;q=0.9,zh-CN;q=0.8,zh;q=0.7,fr-FR;q=0.6,fr;q=0.5,en-US;q=0.4,en;q=0.3', 'cache-control': 'no-cache', 'pragma': 'no-cache', 'priority': 'u=1, i', 'sec-ch-ua': '""Chromium"";v=""142"", ""Google Chrome"";v=""142"", ""Not_A Brand"";v=""99""', 'sec-ch-ua-mobile': '?0', 'sec-ch-ua-platform': '""Windows""', 'sec-fetch-dest': 'empty', 'sec-fetch-mode': 'cors', 'sec-fetch-site': 'cross-site', 'Referer': 'https://goatembed.com/', 'User-Agent': 'Mozilla/5.0 (Windows NT 10.0; Win64; x64) AppleWebKit/537.36 (KHTML, like Gecko) Chrome/142.0.0.0 Safari/537.36'}"
chi-n-binh-b-o-en,chi-n-binh-b-o-en,Chiến Binh Báo Đen,"Wakanda hiện ra như một vương quốc bí ẩn, ẩn mình giữa núi rừng sâu thẳm. Nơi đây sở hữu lượng Vibranium - kim loại quý hiếm và quyền lực nhất trên thế giới. Black Panther, vị vua trẻ tuổi trị vì Wakanda, khoác lên mình bộ giáp chống đạn và sở hữu móng vuốt sắc bén như dao găm. Tuy nhiên, trái tim anh lại ẩn chứa lòng nhân ái và sự trắc ẩn, điều này vô tình trở thành rào cản khi Black Panther đối mặt với những hiểm nguy và âm mưu tranh giành quyền lực sau khi vua cha băng hà.",2018,2h 15m,7.3,https://static.nutscdn.com/vimg/300-0/2b6766253490d87cef639b0e030c5523.jpg,https://static.nutscdn.com/vimg/300-0/2b6766253490d87cef639b0e030c5523.jpg,,https://hitmefirstcdn.store/hls/pnJp2NnKVggkukC1rii1zcITW9W85k-rMnz6ir0IQIjkj2WAz2Bc+id5GP5g38Tm0JGZ9oHhUS2cDxqrUHy8laaVbettIj8WtC5TP58UkAo=/bWFzdGVyLm0zdTg=.m3u8,hls,"['Hành Động', 'Chiếu Rạp', 'Siêu Anh Hùng', 'Marve', 'l Khoa Học', 'Phiêu Lưu']","['Hành động', 'Khoa học viễn tưởng']","['Chadwick Boseman', 'Michael B. Jordan']"," Andy Gill, Lisa C. Satriano, Ryan Coogler",0,2025-11-26 02:46:31.882,2025-11-26 02:46:31.882,"{'accept': '*/*', 'accept-language': 'vi-VN,vi;q=0.9,zh-CN;q=0.8,zh;q=0.7,fr-FR;q=0.6,fr;q=0.5,en-US;q=0.4,en;q=0.3', 'cache-control': 'no-cache', 'pragma': 'no-cache', 'priority': 'u=1, i', 'sec-ch-ua': '""Chromium"";v=""142"", ""Google Chrome"";v=""142"", ""Not_A Brand"";v=""99""', 'sec-ch-ua-mobile': '?0', 'sec-ch-ua-platform': '""Windows""', 'sec-fetch-dest': 'empty', 'sec-fetch-mode': 'cors', 'sec-fetch-site': 'cross-site', 'Referer': 'https://goatembed.com/', 'User-Agent': 'Mozilla/5.0 (Windows NT 10.0; Win64; x64) AppleWebKit/537.36 (KHTML, like Gecko) Chrome/142.0.0.0 Safari/537.36'}"
x-men-logan,x-men-logan,X-Men: Logan,"Lấy bối cảnh năm 2029, giống loài dị nhân gần như bị tuyệt diệt. Wolverine lúc này phải đối mặt với sự lão hóa cả về thể chất lẫn khả năng phục hồi. Anh cùng với Giáo sư X, người lúc này đang mắc chứng bệnh Alzheimer, phải hợp sức để bảo vệ cô bé dị nhân Laura Kinney. Đối chọi với một đội quân ác nhân mạnh mẽ do Donald Pierce dẫn đầu và một tổ chức khổng lồ bí ẩn ở phía sau, liệu họ có bảo toàn được tính mạng và viết tiếp câu chuyện của mình ...",2017,2h 17m,8.1,https://static.nutscdn.com/vimg/300-0/bf0baeff0cc651a496f8efe17ad0de66.jpg,https://static.nutscdn.com/vimg/300-0/bf0baeff0cc651a496f8efe17ad0de66.jpg,,https://hitmefirstcdn.store/hls/uw+P9RDDZXQ6LpdaiH9ns3CyeWVkbuwLA+CC9HjBPkUHEhb1L3qhTMpsIgQG-9i7envzhow7umOwWTCYR9ZFrw==/bWFzdGVyLm0zdTg=.m3u8,hls,"['Chính Kịch', 'Hành Động', 'Chiếu Rạp', 'Siêu Anh Hùng', 'Marve', 'l Khoa Học', 'Phiêu Lưu']","['Hành động', 'Khoa học viễn tưởng']",['Hugh Jackman'],"Michael Musteric, Sheila Waldron",0,2025-11-26 02:46:31.882,2025-11-26 02:46:31.882,"{'accept': '*/*', 'accept-language': 'vi-VN,vi;q=0.9,zh-CN;q=0.8,zh;q=0.7,fr-FR;q=0.6,fr;q=0.5,en-US;q=0.4,en;q=0.3', 'cache-control': 'no-cache', 'pragma': 'no-cache', 'priority': 'u=1, i', 'sec-ch-ua': '""Chromium"";v=""142"", ""Google Chrome"";v=""142"", ""Not_A Brand"";v=""99""', 'sec-ch-ua-mobile': '?0', 'sec-ch-ua-platform': '""Windows""', 'sec-fetch-dest': 'empty', 'sec-fetch-mode': 'cors', 'sec-fetch-site': 'cross-site', 'Referer': 'https://goatembed.com/', 'User-Agent': 'Mozilla/5.0 (Windows NT 10.0; Win64; x64) AppleWebKit/537.36 (KHTML, like Gecko) Chrome/142.0.0.0 Safari/537.36'}"
avengers-ch-ultron,avengers-ch-ultron,Avengers: Đế Chế Ultron,"Tony Stark (Iron Man) và Bruce Banner (Hulk) tạo ra Ultron, một trí tuệ nhân tạo tiên tiến, nhằm bảo vệ thế giới khỏi các mối đe dọa tiềm ẩn. Tuy nhiên, Ultron nhận thức được bản thân và quyết định tiêu diệt nhân loại. Các thành viên Avengers mâu thuẫn về cách thức đối phó với Ultron, dẫn đến chia rẽ và tan rã.Wanda Maximoff (Scarlet Witch) và Vision, hai nhân vật mới với sức mạnh phi thường, tham gia vào cuộc chiến chống lại Ultron.",2015,2h 21m,7.3,https://static.nutscdn.com/vimg/300-0/7cd2a65a3a926c4652ea9c00e5181f84.jpg,https://static.nutscdn.com/vimg/300-0/7cd2a65a3a926c4652ea9c00e5181f84.jpg,,https://snowbreeze49.live/hls/vWPyPVfaiSjZ4DUS8EwjtpxxdurDGFZDeMYvHjts911VQQqLWjcuKkOAt4sJoGZw5KkwguSGt6D7pvXnbB+EJQ==/bWFzdGVyLm0zdTg=.m3u8,hls,"['Hành Động', 'Chiếu Rạp', 'Siêu Anh Hùng', 'Marvel', 'Khoa Họ', 'c Phiêu Lưu']","['Hành động', 'Khoa học viễn tưởng']","['Robert Downey Jr', 'Chris Hemsworth', 'Mark Ruffalo']","Luca Lachin, Xenia Taylor, Stewart Hamilton",0,2025-11-26 02:46:31.882,2025-11-26 02:46:31.882,"{'accept': '*/*', 'accept-language': 'vi-VN,vi;q=0.9,zh-CN;q=0.8,zh;q=0.7,fr-FR;q=0.6,fr;q=0.5,en-US;q=0.4,en;q=0.3', 'cache-control': 'no-cache', 'pragma': 'no-cache', 'priority': 'u=1, i', 'sec-ch-ua': '""Chromium"";v=""142"", ""Google Chrome"";v=""142"", ""Not_A Brand"";v=""99""', 'sec-ch-ua-mobile': '?0', 'sec-ch-ua-platform': '""Windows""', 'sec-fetch-dest': 'empty', 'sec-fetch-mode': 'cors', 'sec-fetch-site': 'cross-site', 'Referer': 'https://goatembed.com/', 'User-Agent': 'Mozilla/5.0 (Windows NT 10.0; Win64; x64) AppleWebKit/537.36 (KHTML, like Gecko) Chrome/142.0.0.0 Safari/537.36'}"
doraemon-movie-44-nobita-v-cu-c-phi-u-l-u-v-o-th-gi-i-trong-tranh,doraemon-movie-44-nobita-v-cu-c-phi-u-l-u-v-o-th-gi-i-trong-tranh,Doraemon Movie 44: Nobita Và Cuộc Phiêu Lưu Vào Thế Giới Trong Tranh,"Doraemon Movie 44 cũng là tác phẩm kỷ niệm 45 năm ra mắt loạt phim ""Doraemon the Movie'"". Câu chuyện của phim kể về Doraemon, Nobita và những người bạn bước vào một bức tranh đến thế giới châu Âu thời Trung cổ. Trong bức tranh, họ gặp những đứa trẻ đến từ đất nước Artoria. Họ cũng chạm trán một con quỷ nhỏ có cánh tên là Chai. Cùng nhau, họ đối mặt với một kẻ thù mạnh mẽ để giành lấy một viên ngọc huyền thoại.",2025,1h 45m,7.3,https://static.nutscdn.com/vimg/300-0/d0f979ab72160593e538fcc702b7e749.jpg,https://static.nutscdn.com/vimg/300-0/d0f979ab72160593e538fcc702b7e749.jpg,,https://hitmefirstcdn.store/hls/E7U0MrAC6Z+TI83oM0gIamESdRvfvk65u1ZfEZVYwH065rd9kd8q+lIgOjKDcIb2E3VMAIShPA5B+rmoUf--BA==/bWFzdGVyLm0zdTg=.m3u8,hls,"['Gia Đình', 'Anime', 'Hoạt Hình', 'Kinh Điển', 'Viễn Tưởng', 'Phiêu Lưu']","['Hành động', 'Khoa học viễn tưởng']",['Wasabi Mizuta-voice']," Takuya Fujikura, Shigeo Koshi, Yukiyo Teramoto, Takuya Ogasawara",0,2025-11-26 02:46:31.882,2025-11-26 02:46:31.882,"{'accept': '*/*', 'accept-language': 'vi-VN,vi;q=0.9,zh-CN;q=0.8,zh;q=0.7,fr-FR;q=0.6,fr;q=0.5,en-US;q=0.4,en;q=0.3', 'cache-control': 'no-cache', 'pragma': 'no-cache', 'priority': 'u=1, i', 'sec-ch-ua': '""Chromium"";v=""142"", ""Google Chrome"";v=""142"", ""Not_A Brand"";v=""99""', 'sec-ch-ua-mobile': '?0', 'sec-ch-ua-platform': '""Windows""', 'sec-fetch-dest': 'empty', 'sec-fetch-mode': 'cors', 'sec-fetch-site': 'cross-site', 'Referer': 'https://goatembed.com/', 'User-Agent': 'Mozilla/5.0 (Windows NT 10.0; Win64; x64) AppleWebKit/537.36 (KHTML, like Gecko) Chrome/142.0.0.0 Safari/537.36'}"
