query,movie_text
phim người nhện hoạt hình,Người Nhện: Du Hành Vũ Trụ. Hành động;Hoạt hình;Siêu anh hùng. Peter Parker bước vào đa vũ trụ cùng nhiều phiên bản Người Nhện khác.
phim spider man đa vũ trụ,Người Nhện: Du Hành Vũ Trụ. Hành động;Hoạt hình;Siêu anh hùng. Peter Parker bước vào đa vũ trụ cùng nhiều phiên bản Người Nhện khác.
phim robot biến hình,Transformers. Khoa học viễn tưởng;Hành động. Robot biến hình chiến đấu bảo vệ Trái Đất.
phim người sói buồn,Logan. Hành động;Siêu anh hùng;Tâm lý. Wolverine già nua bảo vệ cô bé dị nhân trong bối cảnh tương lai u ám.
phim siêu anh hùng buồn,Logan. Hành động;Siêu anh hùng;Tâm lý. Wolverine già nua bảo vệ cô bé dị nhân trong bối cảnh tương lai u ám.
phim phù thủy trẻ con,Harry Potter và Hòn Đá Phù Thủy. Giả tưởng;Phiêu lưu. Cậu bé Harry phát hiện mình là phù thủy và bắt đầu học tại Hogwarts.
phim phép thuật hogwarts,Harry Potter và Hòn Đá Phù Thủy. Giả tưởng;Phiêu lưu. Cậu bé Harry phát hiện mình là phù thủy và bắt đầu học tại Hogwarts.
phim đua xe hành động,Fast & Furious 9. Hành động;Đua xe. Dominic Toretto đối mặt với quá khứ và người em trai nguy hiểm.
fast 9,Fast & Furious 9. Hành động;Đua xe. Dominic Toretto đối mặt với quá khứ và người em trai nguy hiểm.
